{
  "schema_version": "1.0",
  "repo": {
    "root": ".",
    "commit": "0123456789abcdef0123456789abcdef01234567",
    "generated_at": "2026-07-20T16:00:00Z"
  },
  "nodes": [
    {
      "id": "comp:auth",
      "kind": "component",
      "role": "source",
      "label": "Authentication",
      "summary": "Authentication and session persistence.",
      "prose_source": "heuristic",
      "children": ["mod:auth.core"],
      "files": [],
      "metrics": { "loc": 84, "fan_in": 0, "fan_out": 0 }
    },
    {
      "id": "mod:auth.core",
      "kind": "module",
      "role": "source",
      "label": "Auth Core",
      "summary": "2 files; exports Session and SessionStore.",
      "prose_source": "heuristic",
      "children": ["file:src/auth/session.py", "file:src/auth/store.py"],
      "files": [],
      "metrics": { "loc": 84, "fan_in": 0, "fan_out": 0 }
    },
    {
      "id": "file:src/auth/session.py",
      "kind": "file",
      "role": "source",
      "label": "session.py",
      "summary": "Session lifecycle operations.",
      "prose_source": "heuristic",
      "children": [],
      "files": ["src/auth/session.py"],
      "metrics": { "loc": 52, "fan_in": 0, "fan_out": 1 }
    },
    {
      "id": "file:src/auth/store.py",
      "kind": "file",
      "role": "source",
      "label": "store.py",
      "summary": "Session storage operations.",
      "prose_source": "heuristic",
      "children": [],
      "files": ["src/auth/store.py"],
      "metrics": { "loc": 32, "fan_in": 1, "fan_out": 0 }
    },
    {
      "id": "file:src/generated/api.ts",
      "kind": "file",
      "role": "generated",
      "label": "api.ts",
      "summary": "Generated API client bindings.",
      "prose_source": "heuristic",
      "children": [],
      "files": ["src/generated/api.ts"],
      "metrics": { "loc": 210, "fan_in": 0, "fan_out": 0 }
    }
  ],
  "edges": [
    {
      "source": "file:src/auth/session.py",
      "target": "file:src/auth/store.py",
      "kind": "imports",
      "evidence": [{ "file": "src/auth/session.py", "line": 4 }],
      "weight": 1,
      "label": "SessionStore"
    }
  ],
  "levels": {
    "system": ["comp:auth"],
    "component": {
      "comp:auth": ["mod:auth.core"]
    },
    "module": {
      "mod:auth.core": ["file:src/auth/session.py", "file:src/auth/store.py"]
    }
  },
  "capabilities": {
    "supported_edge_kinds": ["imports"]
  },
  "audit": {
    "ruleset": "1",
    "summary": {
      "files": 3,
      "modules": 1,
      "components": 1,
      "edges": 1,
      "warnings": 0,
      "notices": 0
    },
    "findings": []
  }
}
